<?xml version="1.0" encoding="UTF-8"?>
<logiciels 
    xmlns:xsi="http://www.w3.org/2001/XMLSchema-instance"
    xsi:noNamespaceSchemaLocation="SERIE3_EX2.xsd">
    <logiciel>
        <nom>Logiciel Educatif </nom>
        <createur>Créateur 1</createur>
        <version>1.0</version>
        <licence>payant</licence>
        <plateforme>Win</plateforme>
        <date>2022-01-01</date>
        <identifiant>1</identifiant>
        <langue>fr</langue>
        <fonctionnalite>
            <aptitude>0.3</aptitude>
            <accuracy>0.2</accuracy>
            <interoperability>0.2</interoperability>
            <regulatoryCompliance>0.4</regulatoryCompliance>
            <security>0.1</security>
        </fonctionnalite>
        <fiabilite>
            <maturity>0.2</maturity>
            <faultTolerance>0.4</faultTolerance>
            <recoverability>0.5</recoverability>
        </fiabilite>
        <utilisabilite>
            <comprehensibility>0.1</comprehensibility>
            <easeOfLearning>0.2</easeOfLearning>
            <exploitability>0.3</exploitability>
        </utilisabilite>
        <efficacite>
            <resourceEfficiency>0.1</resourceEfficiency>
            <timeEfficiency>0.2</timeEfficiency>
        </efficacite>
        <maintenabilite>
            <testability>0.1</testability>
            <stability>0.2</stability>
            <modifiability>0.4</modifiability>
            <analyzability>0.1</analyzability>
        </maintenabilite>
        <portabilite>
            <interchangeability>0.1</interchangeability>
            <portabilityCompliance>0.2</portabilityCompliance>
            <installability>0.3</installability>
            <adaptability>0.4</adaptability>
        </portabilite>
       
        <!--<fonctionnalite>0.8</fonctionnalite>
        <fiabilite>0.9</fiabilite>
        <utilisabilite>0.7</utilisabilite>
        <efficacite>0.8</efficacite>
        <maintenabilite>0.6</maintenabilite>
        <portabilite>0.5</portabilite>-->
    </logiciel>
    <logiciel>
        <nom>Logiciel </nom>
        <createur>Créateur 2</createur>
        <version>2.0</version>
        <licence>free</licence>
        <plateforme>Unix</plateforme>
        <date>2022-02-02</date>
        <identifiant>2</identifiant>
        <langue>en</langue>
        <fonctionnalite>
            <aptitude>0.3</aptitude>
            <accuracy>0.2</accuracy>
            <interoperability>0.2</interoperability>
            <regulatoryCompliance>0.4</regulatoryCompliance>
            <security>0.1</security>
        </fonctionnalite>
        <fiabilite>
            <maturity>0.2</maturity>
            <faultTolerance>0.4</faultTolerance>
            <recoverability>0.5</recoverability>
        </fiabilite>
        <utilisabilite>
            <comprehensibility>0.1</comprehensibility>
            <easeOfLearning>0.2</easeOfLearning>
            <exploitability>0.3</exploitability>
        </utilisabilite>
        <efficacite>
            <resourceEfficiency>0.1</resourceEfficiency>
            <timeEfficiency>0.2</timeEfficiency>
        </efficacite>
        <maintenabilite>
            <testability>0.1</testability>
            <stability>0.2</stability>
            <modifiability>0.4</modifiability>
            <analyzability>0.1</analyzability>
        </maintenabilite>
        <portabilite>
            <interchangeability>0.1</interchangeability>
            <portabilityCompliance>0.2</portabilityCompliance>
            <installability>0.3</installability>
            <adaptability>0.4</adaptability>
        </portabilite>
    </logiciel>
</logiciels>
